Pub Date,Headline,Snippet,Lead Paragraph,abstract,Source,Web URL
2022-07-01T01:34:46+0000,Former Apple Lawyer Pleads Guilty to Insider Trading,The official was the senior director of corporate law at Apple until he was fired in late 2018.,"A former senior lawyer at Apple who enforced its insider-trading policies pleaded guilty on Thursday to perpetrating an insider-trading scheme, which prosecutors said had involved making stock transactions before the company announced it fell short of iPhone sales expectations.",The official was the senior director of corporate law at Apple until he was fired in late 2018.,The New York Times,https://www.nytimes.com/2022/06/30/business/apple-levoff-insider-trading.html
2022-07-02T00:10:53+0000,"The Best Movies and TV Shows Coming to HBO, Hulu, Apple TV+ and More in July","Every month, streaming services add movies and TV shows to their libraries. Here are our picks for some of July’s most promising new titles.","(Note: Streaming services occasionally change schedules without giving notice. For more recommendations on what to stream, sign up for our Watching newsletter here.)","Every month, streaming services add movies and TV shows to their libraries. Here are our picks for some of July’s most promising new titles.",The New York Times,https://www.nytimes.com/2022/07/01/arts/television/hbo-hulu-amazon.html
2022-07-08T09:00:01+0000,5 Things to Do This Weekend,"Selections from the Weekend section, including a review of ""Thor: Love and Thunder.""","Selections from the Weekend section, including a review of ""Thor: Love and Thunder.""","Selections from the Weekend section, including a review of ""Thor: Love and Thunder.""",The New York Times,https://www.nytimes.com/interactive/2022/07/08/arts/weekend-editors-picks-thor-love-and-thunder.html
2022-07-07T18:42:54+0000,‘Black Bird’ Review: Making Friends With a May-Be Killer,Paul Walter Hauser of “Richard Jewell” gives a tour-de-force performance in a mini-series inspired by a true story of serial killings and jailhouse intrigue.,"“Black Bird,” a new mini-series on Apple TV+ (premiering Friday) that dramatizes a creepy Midwestern true-crime story from the 1990s, has some significant names attached to it. It was developed for television by the top-flight crime writer Dennis Lehane (“The Wire,” “Mr. Mercedes”). Its nominal star, Taron Egerton (“Rocketman”), is a candidate to be Marvel’s next Wolverine. And, in a smaller role, it features one of the last performances by Ray Liotta, who died in May.",Paul Walter Hauser of “Richard Jewell” gives a tour-de-force performance in a mini-series inspired by a true story of serial killings and jailhouse intrigue.,The New York Times,https://www.nytimes.com/2022/07/07/arts/television/black-bird-review.html
2022-07-01T13:19:04+0000,"After ‘Rocketman’, Taron Egerton Transforms Again for ‘Black Bird’","The 32-year-old plays an imprisoned drug dealer facing an unusual choice in the Apple TV+ series, written by Dennis Lehane.","Taron Egerton channeled a pop god in the Elton John biopic “Rocketman,” winning raves — and a Golden Globe — for his portrayal of how a shy piano prodigy blossomed into an international superstar.","The 32-year-old plays an imprisoned drug dealer facing an unusual choice in the Apple TV+ series, written by Dennis Lehane.",The New York Times,https://www.nytimes.com/2022/07/01/arts/television/taron-egerton-black-bird.html
2022-07-03T00:00:00+0000,Mac Salad,,"Hawaii’s mac salad is not the summer standard of cookouts on the mainland (what locals call the rest of the United States). The pasta is cooked past al dente, until swoony and soft all the way through. In this version from the chef Mark Noguchi, Gooch to friends, there’s a little punch-up of Tabasco and trace sweetness, like a sidelong glance, from grated carrots and a grace note of sugar. The marquee ingredient, of course, is mayonnaise. ‘‘Just so you know, you’ll be using a lot of mayo,’’ Gooch warns. ‘‘Obscene, guarantee-going-to-make-you-raise-your-eyebrow kine of lot.” Yet somehow what you end up with is richness without weight, leavened by tang and salt. In Hawaii, a scoop would be served with a plate lunch, alongside rice and a main dish, like <a href=""https://cooking.nytimes.com/recipes/1021957-chicken-katsu"">chicken katsu</a>.",,,https://cooking.nytimes.com/recipes/1023290-mac-salad
2022-07-07T13:58:46+0000,"‘Moon, 66 Questions’ Review: Daddy Issues",This elliptical drama by the Greek writer-director Jacqueline Lentzou rousingly summons the inner turmoil of a young woman who returns home to care for her ailing father.,"The writer and director Jacqueline Lentzou’s “Moon, 66 Questions” takes cues from astrology, using Tarot cards to represent each new chapter of a story about a young woman, Artemis (Sofia Kokkali), who returns to Athens to care for her ailing father.",This elliptical drama by the Greek writer-director Jacqueline Lentzou rousingly summons the inner turmoil of a young woman who returns home to care for her ailing father.,The New York Times,https://www.nytimes.com/2022/07/07/movies/moon-66-questions-review.html
2022-07-08T00:03:27+0000,9 James Caan Movies to Stream,"Drama, comedy, suspense, action, kids’ movies — there was truly nothing he couldn’t do. Who else could star in both “The Godfather” and “Elf”?","When James Caan’s family announced his death on Thursday, it sent shock waves through cinematic circles — not because his passing was particularly premature (he was 82), but because he seemed such a vibrant and outsize personality, you figured he just might live forever.","Drama, comedy, suspense, action, kids’ movies — there was truly nothing he couldn’t do. Who else could star in both “The Godfather” and “Elf”?",The New York Times,https://www.nytimes.com/2022/07/07/movies/james-caan-movies-streaming.html
2022-07-07T11:00:07+0000,‘Dreaming Walls: Inside the Chelsea Hotel’ Review: Bohemia’s Holdouts,This documentary offers an immersion in the lives of residents who keep the building’s spirit as a home for artists alive through a protracted renovation.,"Early in “Dreaming Walls: Inside the Chelsea Hotel,” a construction worker says that the famed building has “a lot of ghosts.”",This documentary offers an immersion in the lives of residents who keep the building’s spirit as a home for artists alive through a protracted renovation.,The New York Times,https://www.nytimes.com/2022/07/07/movies/dreaming-walls-inside-the-chelsea-hotel-review.html
2022-07-01T09:00:05+0000,The Single Best Guide I’ve Heard to the Supreme Court’s Rightward Shift,The legal scholar Kate Shaw walks me through the Supreme Court’s decades-long conservative counterrevolution.,"In the past few weeks alone, the Supreme Court has delivered a firestorm of conservative legal victories. States now have far less leeway to restrict gun permits. The right to abortion is no longer constitutionally protected. The Environmental Protection Agency has been kneecapped in its ability to regulate carbon emissions, and by extension, all executive branch agencies will see their power significantly diminished.",The legal scholar Kate Shaw walks me through the Supreme Court’s decades-long conservative counterrevolution.,The New York Times,https://www.nytimes.com/2022/07/01/opinion/ezra-klein-podcast-kate-shaw.html
2022-07-20T10:35:32+0000,Who Will Make Apple Fashionable Now?,"With the metaverse looming, a shift in designer could make a big difference.","So Jony Ive, the former Apple chief design officer and consultant, and the man most responsible for the visual allure of Apple products — the man who helped transform computers and phones into objects of desire, who made them more than mere vectors of functionality, but rather badges of identity — and his erstwhile employer have reportedly agreed to sever their last ties.","With the metaverse looming, a shift in designer could make a big difference.",The New York Times,https://www.nytimes.com/2022/07/20/style/apple-jony-ive-headset.html
2022-07-12T21:14:22+0000,"Apple Ends Consulting Agreement With Jony Ive, Its Former Design Leader","Three years after promising to work “long into the future” with the man behind its candy-colored computers, Apple and Mr. Ive are through.","SAN FRANCISCO — When Jony Ive, Apple’s influential design leader, exited the company in 2019, Tim Cook, its chief executive, reassured customers that Mr. Ive, the man who gave the world candy-colored computers, would work exclusively with the company for many years.","Three years after promising to work “long into the future” with the man behind its candy-colored computers, Apple and Mr. Ive are through.",The New York Times,https://www.nytimes.com/2022/07/12/technology/apple-jony-ive-end-agreement.html
2022-07-20T21:53:32+0000,Apple Agrees to $50 Million Settlement Over Butterfly Keyboard Complaints,"A class-action lawsuit represented customers who sought repairs for the troubled MacBook keyboard, released in certain laptops from 2015 to 2019. Many were frustrated by typing errors.","Apple agreed on Monday to pay a $50 million settlement on a class-action lawsuit over so-called butterfly keyboards, a component of some MacBook laptops that left many users fuming in key-smashing frustration over typing failures.","A class-action lawsuit represented customers who sought repairs for the troubled MacBook keyboard, released in certain laptops from 2015 to 2019. Many were frustrated by typing errors.",The New York Times,https://www.nytimes.com/2022/07/20/technology/apple-macbook-butterfly-key-settlement.html
2022-07-12T00:00:00+0000,"The Best Apple Prime Day Deals 2022: Apple Watch, Mac Mini, and iPad","Apple discounts are few and far between, but Prime Day is one of the rare times you can find solid deals on Apple products. Here are the best deals we’ve found so far.","Apple discounts are few and far between, but Prime Day is one of the rare times you can find solid deals on Apple products. Here are the best deals we’ve found so far.","Apple discounts are few and far between, but Prime Day is one of the rare times you can find solid deals on Apple products. Here are the best deals we’ve found so far.",Wirecutter,https://www.nytimes.com/wirecutter/money/prime-day-apple-deals-2022-0712/
2022-07-15T00:00:00+0000,Why We Don’t Trust Apple’s HomeKit Secure Video—and You Shouldn’t Either,"Smart-home enthusiasts are often drawn to Apple’s HomeKit platform for its relative simplicity and enhanced security measures. Similarly, Apple HomeKit Secure Video (HSV) for security cameras looks absolutely terrific—at least on paper. In the plu...","Smart-home enthusiasts are often drawn to Apple’s HomeKit platform for its relative simplicity and enhanced security measures. Similarly, Apple HomeKit Secure Video (HSV) for security cameras looks absolutely terrific—at least on paper. In the plus column, this streamlined video cloud service is secured by end-to-end encryption, the gold standard for protecting personal data on smart...","Smart-home enthusiasts are often drawn to Apple’s HomeKit platform for its relative simplicity and enhanced security measures. Similarly, Apple HomeKit Secure Video (HSV) for security cameras looks absolutely terrific—at least on paper. In the plus column, this streamlined video cloud service is secured by end-to-end encryption, the gold standard for protecting personal data on smart...",Wirecutter,https://www.nytimes.com/wirecutter/blog/apple-homekit-secure-video-review/
2022-07-12T00:00:00+0000,Prices for Apple AirPods Are Dropping. We Still Don’t Think You Should Buy Them.,"Shopping for a new pair of wireless earbuds can make you feel a little like Goldilocks—with so many styles, sizes, and prices to choose from, finding something that works just right can be difficult. Prime Day, Amazon’s annual deals extravaganza, ...","Shopping for a new pair of wireless earbuds can make you feel a little like Goldilocks—with so many styles, sizes, and prices to choose from, finding something that works just right can be difficult. Prime Day, Amazon’s annual deals extravaganza, doesn’t make the hunt any easier: After scrolling through an overwhelming amount of deals, you...","Shopping for a new pair of wireless earbuds can make you feel a little like Goldilocks—with so many styles, sizes, and prices to choose from, finding something that works just right can be difficult. Prime Day, Amazon’s annual deals extravaganza, doesn’t make the hunt any easier: After scrolling through an overwhelming amount of deals, you...",Wirecutter,https://www.nytimes.com/wirecutter/money/prime-day-airpods-pro-deals-2022/
2022-07-15T00:00:00+0000,Classic Bean Salad,,"You can use any kind or combination of canned beans to make this classic picnic salad, but a mix of white beans, chickpeas and red kidney beans makes it especially colorful. Although this is delicious when freshly made, it gets even better as it sits. If you have time, make it at least an hour or two before serving; it can rest at room temperature for up to 4 hours — but after that, slip it into the fridge. If you want to make this the day before, add the celery and parsley just before serving, so they stay crisp and green.",,,https://cooking.nytimes.com/recipes/1023327-classic-bean-salad
2022-07-20T16:34:56+0000,Streaming Is Sadder Now,"When Netflix and other companies face a loss of faith in the growth potential of streaming, we all will feel it.","It may not yet be noticeable when we flop on the sofa and flip on Netflix, but the golden age of streaming entertainment might be over. We probably won’t like what happens next.","When Netflix and other companies face a loss of faith in the growth potential of streaming, we all will feel it.",The New York Times,https://www.nytimes.com/2022/07/20/technology/streaming-netflix.html
2022-07-15T09:00:07+0000,"A Weird, Wonderful Conversation With Kim Stanley Robinson",The sci-fi giant explains why he’s feeling more hopeful about the planet.,"Kim Stanley Robinson is one of the great living science fiction writers and one of the most astute observers of how planets look, feel and work. His Mars Trilogy imagined what it might be like for humans to settle on the red planet. His best-selling novel “The Ministry for the Future” is a masterful effort at envisioning what might happen to Earth in a future of unchecked climate change. Robinson has a rare command of both science and human nature, and his writing crystallizes how the two must work together if we are to rescue our collective planetary future from possible ruin.",The sci-fi giant explains why he’s feeling more hopeful about the planet.,The New York Times,https://www.nytimes.com/2022/07/15/opinion/ezra-klein-podcast-kim-stanley-robinson.html
2022-07-19T09:00:16+0000,Why Housing Is So Expensive — Particularly in Blue States,"The urban economist Jenny Schuetz breaks down America’s housing crises, the policies that could fix them and the politics standing in the way.","America is experiencing a housing crisis — or, more accurately, multiple housing crises. A massive housing shortage in major cities has resulted in skyrocketing rents. Low- and middle-income individuals find themselves priced out of the places with the most opportunity. Homelessness is rampant in cities across the country. Developers often face the steepest obstacles to building in the places where new housing is needed most. And young people are increasingly viewing homeownership, once a vital part of the American dream, as hopelessly out of reach.","The urban economist Jenny Schuetz breaks down America’s housing crises, the policies that could fix them and the politics standing in the way.",The New York Times,https://www.nytimes.com/2022/07/19/opinion/ezra-klein-podcast-jenny-schuetz.html
2022-07-28T21:17:33+0000,"Apple Continues to Grow, but Profits Drop as Costs Rise",The iPhone maker said it was hurt by Covid-related shutdowns of factories in Shanghai but benefited from its growing services business.,"For years, Apple has surged behind large-scale manufacturing and rising sales in China. But, lately, the tech giant’s reliance on the world’s most populous country has veered from a strength to a vulnerability.",The iPhone maker said it was hurt by Covid-related shutdowns of factories in Shanghai but benefited from its growing services business.,The New York Times,https://www.nytimes.com/2022/07/28/business/apple-earnings.html
2022-07-28T22:46:11+0000,Big Tech Is Proving Resilient as the Economy Cools,"Tech companies are slowing their frenetic hiring, but a combination of dominance and diversity is turning out to be — yet again — an overwhelming asset.","No boom can last forever, even for the technology industry’s most affluent companies. Investors punished the biggest tech companies earlier this year, erasing $2 trillion in market value over fears the industry would falter in the face of rising inflation and a slowing economy.","Tech companies are slowing their frenetic hiring, but a combination of dominance and diversity is turning out to be — yet again — an overwhelming asset.",The New York Times,https://www.nytimes.com/2022/07/28/business/big-tech-resilient-economy.html
2022-07-29T19:00:08+0000,Recession? Not for Big Tech.,Many companies are navigating tough times better than investors had feared.,"When the president, the treasury secretary and other Biden administration officials insisted this week that the American economy is not currently in a recession, they were mocked for weaseling out of bad news on a technicality. The Commerce Department announced on Thursday that the broadest measure of economic activity, gross domestic product, fell for a second quarter in a row — meeting a widely held, though unofficial, definition of recession. It is true, as the Biden folks argued, that the nation’s official recession arbiter, the National Bureau of Economic Research, has yet to call one, because it relies on many more signals. Still, it sure sounded as if the Biden team was splitting hairs.",Many companies are navigating tough times better than investors had feared.,The New York Times,https://www.nytimes.com/2022/07/29/opinion/recession-not-for-big-tech.html
2022-07-27T09:00:26+0000,The Default Tech Settings You Should Turn Off Right Away,"These controls, which are buried inside products from Apple, Google, Meta and others, make us share more data than we need to.",There’s a catchy saying going around with a valuable lesson about our personal technology: The devil is in the defaults.,"These controls, which are buried inside products from Apple, Google, Meta and others, make us share more data than we need to.",The New York Times,https://www.nytimes.com/2022/07/27/technology/personaltech/default-settings-turn-off.html
2022-07-28T12:34:01+0000,The Fed Won’t Say the ‘R’ Word,"Chair Jerome Powell was asked in every way possible whether the economy was in, or headed toward, a recession.","The Federal Reserve is continuing its aggressive campaign to cool inflation, even as the economy begins to slow. The U.S. central bank raised interest rates yesterday — this time by three-quarters of a percentage point — for the fourth time this year. Investors cheered the move, with the S&P 500 rising nearly 3 percent by the end of the day. Futures markets suggest stocks will open slightly lower today. The Fed’s benchmark short-term interest rate is now as high as 2.5 percent, up from near-zero in March.","Chair Jerome Powell was asked in every way possible whether the economy was in, or headed toward, a recession.",The New York Times,https://www.nytimes.com/2022/07/28/business/dealbook/federal-reserve-recession-facebook-antitrust.html
2022-07-26T17:00:59+0000,Will Streaming Save Sports or Kill It?,Sports are the lifeblood of TV but also choking it. Big Tech is following a similar playbook.,Sports and TV have thrived together. Our entertainment future will be shaped by whether streaming and sports can repeat that mostly happy partnership.,Sports are the lifeblood of TV but also choking it. Big Tech is following a similar playbook.,The New York Times,https://www.nytimes.com/2022/07/26/technology/streaming-sports.html
2022-07-27T12:09:22+0000,Big Tech and the Fed,"Some tech companies’ earnings are flagging, in what could be a positive sign for the Federal Reserve.","The long-booming bottom lines of major tech companies are all of a sudden smaller than expected. That might be a good thing. Big Tech sailed through the pandemic with its profits mostly intact. The fact that some firms’ results are now flagging could be a positive sign for the Federal Reserve, which is trying to engineer a slowdown as it fights the nation’s worst bout of inflation in four decades.","Some tech companies’ earnings are flagging, in what could be a positive sign for the Federal Reserve.",The New York Times,https://www.nytimes.com/2022/07/27/business/dealbook/big-tech-fed.html
2022-07-26T09:00:21+0000,"With ‘Surface,’ Gugu Mbatha-Raw Steps Into New Territory","The British actress has been prolific in film and television for the past decade, but a new Apple TV+ show is her first time as an executive producer.","LONDON — A few minutes into “Surface,” a new eight-part series from Apple TV+, the central character, Sophie, played by Gugu Mbatha-Raw, asks her therapist a question:","The British actress has been prolific in film and television for the past decade, but a new Apple TV+ show is her first time as an executive producer.",The New York Times,https://www.nytimes.com/2022/07/26/arts/television/gugu-mbatha-raw-surface.html
2022-07-25T12:50:24+0000,Cooling the Economy Without Crushing It,Several signs of economic stress may keep the Fed from raising interest rates to a full percentage point.,"This week, the Federal Reserve will decide on its next move for interest rates. The decision, expected to be announced on Wednesday, will almost certainly be to raise its benchmark rate. The U.S. economy is facing its worst bout of inflation in four decades, and higher interest rates are likely to slow the economy and ease price increases. But how much remains a question.",Several signs of economic stress may keep the Fed from raising interest rates to a full percentage point.,The New York Times,https://www.nytimes.com/2022/07/25/business/dealbook/fed-interest-rates.html
2022-07-24T09:00:13+0000,Why Big Tech Is Making a Big Play for Live Sports,Competing for rights to broadcast games from the N.F.L. and other leagues could be hard for broadcast and cable companies that “aren’t playing by the same financial rules.”,"LOS ANGELES — More than a decade after Apple disrupted the music industry and Amazon upended retail, the tech heavyweights have set their sights on a new arena ripe for change: live sports.",Competing for rights to broadcast games from the N.F.L. and other leagues could be hard for broadcast and cable companies that “aren’t playing by the same financial rules.”,The New York Times,https://www.nytimes.com/2022/07/24/technology/sports-streaming-rights.html
2022-08-01T09:00:21+0000,Pixar’s Ousted Founder Returns With Apple and ‘Luck’,John Lasseter was toppled five years ago by allegations about his workplace behavior. He’s back with an animated film and a studio that could be Pixar 2.0.,LOS ANGELES — The most Pixar movie of the summer is not from Pixar. It’s from Apple TV+ and the lightning-rod filmmaker-executive who turned Pixar into a superpower: John Lasseter.,John Lasseter was toppled five years ago by allegations about his workplace behavior. He’s back with an animated film and a studio that could be Pixar 2.0.,The New York Times,https://www.nytimes.com/2022/08/01/business/media/john-lasseter-luck-apple.html
2022-08-10T09:00:26+0000,Change These Default Settings and Be Happier With Your Tech,"Simple steps can make your smartphone, computer and TV work better for you.","Many default settings buried deep inside our technology make us share superfluous amounts of data with tech companies. In my last column, I went over how to shut those off.","Simple steps can make your smartphone, computer and TV work better for you.",The New York Times,https://www.nytimes.com/2022/08/10/technology/personaltech/default-settings-change.html
2022-08-05T20:08:00+0000,Clock Running Out on Antitrust Bill Targeting Big Tech,A sweeping bill that would enact the strongest restrictions on Big Tech companies in the United States has been stalled in the Senate.,"WASHINGTON — Critics of the country’s largest tech companies branded the last few months “Hot Antitrust Summer” because they hoped that Congress would vote on new regulations for Amazon, Apple, Google and Facebook.",A sweeping bill that would enact the strongest restrictions on Big Tech companies in the United States has been stalled in the Senate.,The New York Times,https://www.nytimes.com/2022/08/05/business/antitrust-bill-klobuchar.html
