Pub Date,Headline,Snippet,Lead Paragraph,abstract,Source,Web URL
2022-01-05T17:44:31+0000,The Meaning of Apple at $3 Trillion,We aren’t buying more smartphones. So how is this smartphone company making crazy money?,This article is part of the On Tech newsletter. Here is a collection of past columns.,We aren’t buying more smartphones. So how is this smartphone company making crazy money?,The New York Times,https://www.nytimes.com/2022/01/05/technology/apple-profits.html
2022-01-03T18:48:42+0000,Apple Becomes First Company to Hit $3 Trillion Market Value,The iPhone maker’s value tripled since 2018 as its sales continued to soar and it spent hundreds of billions of dollars on its own stock.,"Combine Walmart, Disney, Netflix, Nike, Exxon Mobil, Coca-Cola, Comcast, Morgan Stanley, McDonald’s, AT&T, Goldman Sachs, Boeing, IBM and Ford.",The iPhone maker’s value tripled since 2018 as its sales continued to soar and it spent hundreds of billions of dollars on its own stock.,The New York Times,https://www.nytimes.com/2022/01/03/technology/apple-3-trillion-market-value.html
2022-01-08T23:00:06+0000,Food for Thought,Timothy Polin’s puzzle gives us a good core workout.,"SUNDAY PUZZLE — This is a case where the print introduction to the Sunday puzzle, which I know goes unseen by most solvers, has quite a good teaser to some facets of a terrific grid that I fear will be similarly missed by a lot of people. Shame, really, but don’t feel down, because you’re going to be one of the lucky ones.",Timothy Polin’s puzzle gives us a good core workout.,The New York Times,https://www.nytimes.com/2022/01/08/crosswords/daily-puzzle-2022-01-09.html
2022-01-08T11:00:03+0000,No Longer in Service: BlackBerry Phones Come to Their End,BlackBerry was once Canada’s most valuable company and a global force in tech. The final step in its downfall as a phone maker arrived this week.,"For many years, my work for The New York Times was centered on one thing: BlackBerrys. But this week, the onetime wonder of Canada’s tech industry finally faded out as a smartphone maker.",BlackBerry was once Canada’s most valuable company and a global force in tech. The final step in its downfall as a phone maker arrived this week.,The New York Times,https://www.nytimes.com/2022/01/08/world/canada/blackberry-phone-service-ends.html
2022-01-05T08:28:38+0000,Cuomo’s Criminal Sexual Assault Case Is Dropped,"The woman who said former Gov. Andrew Cuomo groped her was “credible,” the district attorney said, but proving the charge would be a challenge.","Good morning. It’s Wednesday. We’ll look at the latest development in the sexual harassment scandal involving former Gov. Andrew Cuomo. We’ll also look at the end of the reign of Coney Island’s unofficial mayor, who says he was fired by an organization he started.","The woman who said former Gov. Andrew Cuomo groped her was “credible,” the district attorney said, but proving the charge would be a challenge.",The New York Times,https://www.nytimes.com/2022/01/05/nyregion/cuomo-criminal-charge-dropped.html
2022-01-03T11:57:56+0000,How Beijing Has Muted Hong Kong’s Independent Media,"Citizen News, a small but aggressive online publication, is the latest outlet to fold amid relentless pressure from the authorities.","HONG KONG — Citizen News, a small online news site in Hong Kong known for its in-depth coverage of courts and local politics, said it would stop publishing on Monday night, deepening concerns about the collapse of the city’s once-robust media.","Citizen News, a small but aggressive online publication, is the latest outlet to fold amid relentless pressure from the authorities.",The New York Times,https://www.nytimes.com/article/hong-kong-media-muzzled.html
2022-01-04T21:37:50+0000,"Election Falsehoods Surged on Podcasts Before Capitol Riots, Researchers Find","A new study analyzed nearly 1,500 episodes, showing the extent to which podcasts pushed misinformation about voter fraud.","Weeks before the 2020 presidential election, the conservative broadcaster Glenn Beck outlined his prediction for how Election Day would unfold: President Donald J. Trump would be winning that night, but his lead would erode as dubious mail-in ballots arrived, giving Joseph R. Biden Jr. an unlikely edge.","A new study analyzed nearly 1,500 episodes, showing the extent to which podcasts pushed misinformation about voter fraud.",The New York Times,https://www.nytimes.com/2022/01/04/technology/apple-google-spotify-podcast-election-misinformation.html
2022-01-05T00:00:00+0000,Caramelized Apple King Cake,,"Though there are many versions of king cake — the pastry eaten from Twelfth Night through Mardi Gras — many New Orleanians trace their best memories back to their local bakery. Such is the case for the Creole chef and New Orleans native Dominick Lee. His recipe was inspired by childhood memories of king cakes with apple filling served in the city’s Gentilly neighborhood. Mr. Lee retains that filling in his cake and takes inspiration from global influences, adding a fragrant orange blossom cream-cheese frosting. True to tradition, a plastic baby is hidden within the cake. The person who finds and eats the slice with the baby is promised luck and prosperity, and — fair warning — is also responsible for providing the next cake.",,,https://cooking.nytimes.com/recipes/1022851-caramelized-apple-king-cake
2022-01-03T22:40:32+0000,"Omicron, Apple, Jan. 6: Your Monday Evening Briefing",Here’s what you need to know at the end of the day.,(Want to get this newsletter in your inbox? Here’s the sign-up.) ,Here’s what you need to know at the end of the day.,The New York Times,https://www.nytimes.com/2022/01/03/briefing/omicron-apple-jan-6-your-monday-evening-briefing.html
2022-01-07T17:19:01+0000,Stream These 11 Great Performances by Sidney Poitier,"As an actor and filmmaker, he strove to bring layered Black individuals to the screen at a time when that was rare.","Sidney Poitier has died at age 94. A perennial Oscar nominee in the 1960s, Poitier became a movie star at a time when Hollywood tended to relegate Black actors to roles as servants, appearing for just a scene or two, often as comic relief. But he was rarely a supporting player, even at the start of his career. He took leads, specializing in a specific type: the educated, well-mannered, middle-class professional who had assimilated into the parts of white society willing to accept him.","As an actor and filmmaker, he strove to bring layered Black individuals to the screen at a time when that was rare.",The New York Times,https://www.nytimes.com/2022/01/07/movies/sidney-poitier-movies.html
2022-01-20T18:47:23+0000,‘The Tiger Rising’ Review: A Cage of Clichés,"A lonely boy finds an ally when he discovers a caged tiger in a forest behind his home, but imagination is somehow short-lived in this children’s movie.","In the children’s drama “The Tiger Rising,” a lonely boy whose mother recently died finds a spiritual ally when he discovers a caged tiger in a forest behind his home in rural Florida.","A lonely boy finds an ally when he discovers a caged tiger in a forest behind his home, but imagination is somehow short-lived in this children’s movie.",The New York Times,https://www.nytimes.com/2022/01/20/movies/the-tiger-rising-review.html
2022-01-18T19:28:55+0000,Regulators aim to rewrite rules for big mergers.,U.S. antitrust leaders said they would focus on the tech industry’s free services as they strengthened the review process for corporate consolidation.,"WASHINGTON — Top federal antitrust officials on Tuesday announced a review of how they approve mergers and acquisitions, in a broad effort to strengthen enforcement and clamp down on a surge of corporate consolidation, particularly in high tech.",U.S. antitrust leaders said they would focus on the tech industry’s free services as they strengthened the review process for corporate consolidation.,The New York Times,https://www.nytimes.com/2022/01/18/technology/regulators-aim-to-rewrite-rules-for-big-mergers.html
2022-01-20T13:22:11+0000,Efforts to Rein In Big Tech May Be Running Out of Time,"With midterm elections approaching, a vote taken on Thursday could be the first of several that Congress takes on bills aimed at the industry.","Lawmakers on Capitol Hill are readying a major push on bills aimed at restraining the power of the country’s biggest tech companies, as they see the window of opportunity closing quickly ahead of the midterm elections.","With midterm elections approaching, a vote taken on Thursday could be the first of several that Congress takes on bills aimed at the industry.",The New York Times,https://www.nytimes.com/2022/01/20/technology/big-tech-senate-bill.html
2022-01-13T12:00:07+0000,‘A Cops and Robbers Story’ Review: Keep Your Enemies Closer,This documentary follows a police officer who rose through the ranks while concealing his criminal past.,"Corey Pegues, the subject of the slim and sober documentary “A Cops and Robbers Story,” started in law enforcement in 1992, eventually becoming a commanding officer in his 20-year career with the New York City Police Department. But as a Black officer, Pegues was often treated with suspicion by his fellow policemen, who would snidely comment that he was too close to the community he was patrolling.",This documentary follows a police officer who rose through the ranks while concealing his criminal past.,The New York Times,https://www.nytimes.com/2022/01/13/movies/a-cops-and-robbers-story-review-keep-your-enemies-closer.html
2022-01-14T10:00:12+0000,"1,760 Acres. That’s How Much More of Manhattan We Need.",Extending the borough into New York Harbor would help the city confront housing and climate crises. ,"On Jan. 1, Eric Adams was sworn in as New York’s 110th mayor. He is now in charge of the city’s response to big, and growing, problems. One is a housing affordability crisis. Another concerns the ravages of climate change: sea level rise, flooding and storm surges.",Extending the borough into New York Harbor would help the city confront housing and climate crises. ,The New York Times,https://www.nytimes.com/2022/01/14/opinion/eric-adams-manhattan-expand.html
2022-01-20T20:55:15+0000,How Much Watching Time Do You Have This Weekend?,The Fraggles are back. Or check out a rapid-fire new comedy college.,"‘The Last Open Mic at the End of the World’When to watch: Now, on YouTube or HBO Max.",The Fraggles are back. Or check out a rapid-fire new comedy college.,The New York Times,https://www.nytimes.com/2022/01/20/arts/television/fraggle-rock-apple-tv-plus.html
2022-01-11T10:00:13+0000,"What Did I Miss? Chris Hayes Fills Me In on Inflation, Covid and the G.O.P.","The political journalist discusses the Biden administration’s successes and failures with the economy, pandemic response and climate change.","Nothing like a newborn and paternity leave to leave you feeling a bit out of the loop. So for my first podcast back since October, I wanted to wander through the thickets of where we are politically and how we got here.","The political journalist discusses the Biden administration’s successes and failures with the economy, pandemic response and climate change.",The New York Times,https://www.nytimes.com/2022/01/11/opinion/ezra-klein-podcast-chris-hayes.html
2022-01-18T17:23:42+0000,‘Nocturna’ Review: A Dark Night of the Soul,A seemingly haunted apartment building terrorizes a bewildered old man in this psychological thriller.,"Divided into two distinct features — the first of which can stand alone, while the second may work best as a dialogue with the first — “Nocturna” weaves memory and nightmare into a haunting tale of loneliness and regret.",A seemingly haunted apartment building terrorizes a bewildered old man in this psychological thriller.,The New York Times,https://www.nytimes.com/2022/01/18/movies/nocturna-review.html
2022-01-18T10:00:06+0000,Zeynep Tufekci on How to Prepare for the Pandemic’s Next Phase,Zeynep Tufekci helps me understand the systems-wide failure on Covid — and how we can prepare for the pandemic’s next phase.,"I remember thinking, as Covid ravaged the country in December 2020, that at least the holidays the next year would be better. There would be more vaccines, more treatments, more immunity. Instead, we got Omicron and a confusing new phase of the pandemic. What do you do with a variant that is both monstrously more infectious and somewhat milder? What do you say about another year when we didn’t have enough tests, enough ventilation or the best guidance on masks? And how do you handle the fracturing politics of a changing pandemic in an exhausted country?",Zeynep Tufekci helps me understand the systems-wide failure on Covid — and how we can prepare for the pandemic’s next phase.,The New York Times,https://www.nytimes.com/2022/01/18/opinion/ezra-klein-podcast-zeynep-tufekci.html
2022-01-19T18:41:04+0000,Exclusive: Lina Khan Is (Still) Bursting Big Tech’s Bubble,The FTC Chair’s exclusive conversation with Kara Swisher and Andrew Ross Sorkin.,"Yesterday, the Federal Trade Commission and the Department of Justice announced they would work to rewrite merger rules in an approach that would clamp down on big tech deals that have allowed companies like Amazon, Google and Facebook to expand their tentacles across industries and across more areas of our lives. Today, Lina Khan sat down with Kara Swisher and DealBook’s editor Andrew Ross Sorkin in an exclusive interview for The New York Times and CNBC.",The FTC Chair’s exclusive conversation with Kara Swisher and Andrew Ross Sorkin.,The New York Times,https://www.nytimes.com/2022/01/19/opinion/sway-kara-swisher-lina-khan.html
2022-01-26T18:34:39+0000,Why Online Stars Are Mad at Apple,Creators who want to make a living online say the fees are too high.,This article is part of the On Tech newsletter. Here is a collection of past columns.,Creators who want to make a living online say the fees are too high.,The New York Times,https://www.nytimes.com/2022/01/26/technology/apple-fees-online-creators.html
2022-01-27T21:54:14+0000,Apple’s profit jumps to $34.6 billion in holiday quarter despite supply issues.,"The company’s revenue and profit beat Wall Street expectations, easing concerns that supply chain problems and the coronavirus were a drag on sales.","Apple weathered the supply chain snarls at the end of 2021 that tripped up the global electronics market and other industries, announcing on Thursday an 11 percent increase in revenue and a 20 percent jump in profit in its most recent quarter while offering optimism that the worst of the problems were behind it.","The company’s revenue and profit beat Wall Street expectations, easing concerns that supply chain problems and the coronavirus were a drag on sales.",The New York Times,https://www.nytimes.com/2022/01/27/technology/apple-earnings.html
2022-01-25T23:54:02+0000,Apple gets restraining order against a woman accused of stalking Tim Cook.,"The woman, a 45-year-old Virginia resident, is accused of threatening Mr. Cook and visiting his home, according to the court documents.","A judge in Santa Clara County has granted Apple a temporary restraining order against a woman accused of stalking and threatening the company’s chief executive, Tim Cook.","The woman, a 45-year-old Virginia resident, is accused of threatening Mr. Cook and visiting his home, according to the court documents.",The New York Times,https://www.nytimes.com/2022/01/25/technology/tim-cook-apple-stalker.html
2022-01-27T19:59:18+0000,‘A Taste of Hunger’ Review: A Relentless Pursuit of Perfection,"A husband and wife pour everything into their restaurant in a quest for a Michelin star, heedless of the other dimensions of their lives.",In the Danish drama “A Taste of Hunger” infidelity and unyielding ambition threaten to derail the relationship between a married couple of restaurateurs.,"A husband and wife pour everything into their restaurant in a quest for a Michelin star, heedless of the other dimensions of their lives.",The New York Times,https://www.nytimes.com/2022/01/27/movies/a-taste-of-hunger-review.html
2022-01-29T10:00:13+0000,It’s Lunar New Year. Get Ready for Some Fruit.,"Oranges. Apples. Pomelos. Eating or giving fruit is a beloved Lunar New Year tradition in many Asian cultures, expressing love and thought to bring good luck.","In the days leading up to the Lunar New Year, Daphne Wu would wait for a pomelo to ripen.","Oranges. Apples. Pomelos. Eating or giving fruit is a beloved Lunar New Year tradition in many Asian cultures, expressing love and thought to bring good luck.",The New York Times,https://www.nytimes.com/2022/01/29/us/lunar-new-year-cut-fruit.html
2022-01-26T19:31:34+0000,E.U. court throws out $1.2 billion antitrust fine against Intel.,Intel had been charged with paying illegal rebates to companies that used its semiconductors over rival Advanced Micro Devices.,"In a defeat for the European Union’s tech antitrust efforts, a top court on Wednesday threw out a $1.2 billion fine issued against Intel more than a decade ago over practices to undercut a rival in the semiconductor industry.",Intel had been charged with paying illegal rebates to companies that used its semiconductors over rival Advanced Micro Devices.,The New York Times,https://www.nytimes.com/2022/01/26/technology/eu-intel-antitrust-fine.html
2022-01-28T13:19:25+0000,"Stocks rally, erasing losses from a turbulent week.","The S&P 500 rose 2.4 percent, its biggest one-day jump since June 2020. But some analysts cautioned against reading too much into a single day’s bounce.","Wall Street finally found a foothold on Friday, rebounding from days of back-to-back declines with its biggest gain in 18 months as investors grabbed on to glimmers of good news: a strong earnings report from Apple and data on wage growth that came in lower than expected.","The S&P 500 rose 2.4 percent, its biggest one-day jump since June 2020. But some analysts cautioned against reading too much into a single day’s bounce.",The New York Times,https://www.nytimes.com/2022/01/28/business/stock-market-today.html
2022-01-25T18:09:52+0000,How to Survive When Stocks Behave Badly,"The stock market’s swings have been startling. Unfortunately, it’s wise to prepare for much worse.",Where is the stock market heading? That can be an urgent question — especially when you’re losing money in a fickle market.,"The stock market’s swings have been startling. Unfortunately, it’s wise to prepare for much worse.",The New York Times,https://www.nytimes.com/2022/01/25/business/stocks-hold-or-sell.html
2022-01-25T10:00:14+0000,What We Gain by Enchanting the Objects in Our Lives,"The novelist and Zen Buddhist priest Ruth Ozeki draws connections between meditation, writing and the art and practice of listening.","The world has gotten louder, even when we’re alone. A day spent in isolation can still mean a day buffeted by the voices on social media and the news, on podcasts, in emails and text messages. Objects have also gotten louder: through the advertisements that follow us around the web, the endless scroll of merchandise available on internet shopping sites and in the plentiful aisles of superstores. What happens when you really start listening to all these voices? What happens when you can’t stop hearing them?","The novelist and Zen Buddhist priest Ruth Ozeki draws connections between meditation, writing and the art and practice of listening.",The New York Times,https://www.nytimes.com/2022/01/25/opinion/ezra-klein-podcast-ruth-ozeki.html
2022-01-26T10:00:23+0000,Oura Ring 3 Review: A Missed Opportunity for Wearable Tech,"At a time when we are concerned about health, the smart ring, which can track sleep and body temperature, is too flawed to recommend.","There couldn’t be a better time for wearable technology to shine. In the coronavirus era, we’re all concerned about our well-being. So wearable computers with tiny sensors that offer insight into our health seem particularly useful.","At a time when we are concerned about health, the smart ring, which can track sleep and body temperature, is too flawed to recommend.",The New York Times,https://www.nytimes.com/2022/01/26/technology/personaltech/oura-ring-3-review.html
2022-02-10T21:07:40+0000,Apple says it will make AirTags easier to find after complaints of stalking.,The $29 devices have become a headache for the company.,Apple said on Thursday that it would make improvements to its AirTag devices to make it more difficult for people to use them to track others without their knowledge.,The $29 devices have become a headache for the company.,The New York Times,https://www.nytimes.com/2022/02/10/business/apple-airtags-safety.html
2022-02-03T19:18:59+0000,"A Change by Apple Is Tormenting Internet Companies, Especially Meta",Meta’s stock prices plunged after the company reported that Apple’s privacy features would cost it billions this year. It’s not the only tech giant to take a hit.,Apple’s vision of a more private web is not necessarily a more profitable one for internet companies that depend on advertising revenue.,Meta’s stock prices plunged after the company reported that Apple’s privacy features would cost it billions this year. It’s not the only tech giant to take a hit.,The New York Times,https://www.nytimes.com/2022/02/03/technology/apple-privacy-changes-meta.html
2022-02-02T10:15:29+0000,Grindr is pulled from Apple’s App Store in China.,The dating app removed itself from Apple’s platform in China because of concerns over data regulations.,"Executives with Grindr, the world’s most popular gay dating app, have pulled it from Apple’s App Store in China over concerns about data regulations, the latest in a series of foreign departures from the Chinese market following new rules.",The dating app removed itself from Apple’s platform in China because of concerns over data regulations.,The New York Times,https://www.nytimes.com/2022/02/02/business/grindr-apple-app-store-china.html
2022-02-01T21:45:53+0000,"The Best Movies and TV Shows Coming to HBO, Hulu, Apple TV+ and More in February","Every month, streaming services add movies and TV shows to its library. Here are our picks for some of February’s most promising new titles.","(Note: Streaming services occasionally change schedules without giving notice. For more recommendations on what to stream, sign up for our Watching newsletter here.)","Every month, streaming services add movies and TV shows to its library. Here are our picks for some of February’s most promising new titles.",The New York Times,https://www.nytimes.com/2022/02/01/arts/television/hbo-hulu-apple-tv-streaming.html
2022-02-03T22:03:42+0000,6 Reasons Meta Is in Trouble,The company formerly known as Facebook has hit major turbulence as it suffered its biggest one-day wipeout ever.,"Meta, the company formerly known as Facebook, suffered its biggest one-day wipeout ever on Thursday as its stock plummeted 26 percent and its market value plunged by more than $230 billion.",The company formerly known as Facebook has hit major turbulence as it suffered its biggest one-day wipeout ever.,The New York Times,https://www.nytimes.com/2022/02/03/technology/facebook-meta-challenges.html
2022-02-04T14:47:35+0000,Stocks climb as investors weigh a surprising jobs report and Amazon earnings.,Investors took the strong jobs showing as a reason for the Federal Reserve to move quickly as it starts to raise interest rates this year.,"Stocks on Wall Street rose on Friday, as an unexpectedly strong jobs report scrambled investors’ expectations for coming interest rate increases and as the latest round of earnings reports offset some fears about declining corporate profits.",Investors took the strong jobs showing as a reason for the Federal Reserve to move quickly as it starts to raise interest rates this year.,The New York Times,https://www.nytimes.com/2022/02/04/business/stock-market-today.html
2022-02-03T17:37:21+0000,What Big Tech’s Riches Mean for Our Future,"Five superpower companies — yes, even Facebook after recent news — are completely enmeshed in our world.",This article is part of the On Tech newsletter. Here is a collection of past columns.,"Five superpower companies — yes, even Facebook after recent news — are completely enmeshed in our world.",The New York Times,https://www.nytimes.com/2022/02/03/technology/big-tech-facebook-earnings.html
2022-02-08T10:00:10+0000,"As Automakers Add Technology to Cars, Software Bugs Follow","Faulty computer systems are prompting class-action lawsuits by disgruntled car owners, a symptom of automakers’ bumpy transition to the digital age.","About six months after Gary Gilpin leased a Subaru Outback from a California dealer, the screen went blank and wouldn’t come back on. Mr. Gilpin took the car to the dealer for what he figured would be a quick reset.","Faulty computer systems are prompting class-action lawsuits by disgruntled car owners, a symptom of automakers’ bumpy transition to the digital age.",The New York Times,https://www.nytimes.com/2022/02/08/business/car-software-lawsuits.html
